{
  "meta": {
    "sourceUrl": "https://ets-leveque.fr",
    "domain": "ets-leveque.fr",
    "extractedAt": "2026-07-07T16:59:31.842Z",
    "pagesCrawled": [
      "https://ets-leveque.fr",
      "https://ets-leveque.fr/",
      "https://ets-leveque.fr/#",
      "https://ets-leveque.fr/notre-equipe/",
      "https://ets-leveque.fr/historique/",
      "https://ets-leveque.fr/nos-activites/energies-renouvelables/"
    ],
    "toolVersion": "1.0.0",
    "warnings": [
      "Nom de l'entreprise déduit heuristiquement (\"Entreprise Lévêque à Notre dame de Sanilhac\") — à confirmer avec le client, pas issu de données structurées fiables",
      "Plusieurs raisons sociales trouvées sur le site (ETS LÉVÊQUE / LÉVÊQUE) — probablement une entité fondatrice vs. une entité actuelle après reprise/transmission. À trancher avec le client, aucune n'a été retenue par défaut.",
      "Adresse déduite heuristiquement (\"3061 ROUTE NATIONALE RN21 LES FARGES - NOTRE DAME DE SANILHAC - 24660 SANILHAC\") — à confirmer avec le client, pas issue de données structurées fiables"
    ]
  },
  "brand": {
    "logo": {
      "candidates": [
        {
          "src": "https://ets-leveque.fr/wp-content/uploads/2024/09/logo-ets-leveque-v3.png",
          "confidence": 0.75,
          "location": "other",
          "width": 344,
          "height": 200,
          "altText": "Entreprise Lévêque à Notre dame de Sanilhac"
        },
        {
          "src": "https://ets-leveque.fr/wp-content/uploads/2024/11/RGE-LOGOS-2-e1732697760471.png",
          "confidence": 0.55,
          "location": "other",
          "width": 900,
          "height": 459,
          "altText": "https://ets-leveque.fr/wp-content/uploads/2024/11/RGE-LOGOS-2-e1732697760471.png"
        },
        {
          "src": "https://ets-leveque.fr/wp-content/uploads/2026/06/ChIJ3d8GLzN6_0cR3m8L0ENcy9c.jpg",
          "confidence": 0.5,
          "location": "header",
          "width": 0,
          "height": 0,
          "altText": "ETS Lévêque place picture"
        }
      ],
      "best": "logo/logo.png",
      "favicon": "https://ets-leveque.fr/wp-content/uploads/2022/10/Logo-Leveque.png"
    },
    "palette": {
      "method": "vibrant-from-logo",
      "swatches": [
        {
          "hex": "#fb0d0e",
          "role": "primary",
          "source": "logo",
          "population": 0.667
        },
        {
          "hex": "#148c9c",
          "role": "secondary",
          "source": "logo",
          "population": 0.181
        },
        {
          "hex": "#fc6c6c",
          "role": "accent",
          "source": "logo",
          "population": 0.125
        },
        {
          "hex": "#5c8c94",
          "role": "dominant",
          "source": "logo",
          "population": 0.014
        },
        {
          "hex": "#54848c",
          "role": "background",
          "source": "logo",
          "population": 0.014
        },
        {
          "hex": "#950303",
          "role": "text",
          "source": "logo",
          "population": 0
        },
        {
          "hex": "#1d7b88",
          "role": "primary",
          "source": "hero-screenshot",
          "population": 0.31
        },
        {
          "hex": "#672425",
          "role": "secondary",
          "source": "hero-screenshot",
          "population": 0.005
        }
      ]
    },
    "typography": {
      "detectedFontFamilies": [
        "Roboto, Arial, sans-serif",
        "Montserrat"
      ],
      "headingFontStack": "Roboto, Arial, sans-serif",
      "bodyFontStack": "Montserrat"
    }
  },
  "company": {
    "name": "Entreprise Lévêque à Notre dame de Sanilhac",
    "tagline": null,
    "metier": [
      "plomberie / chauffage",
      "électricité",
      "rénovation globale"
    ],
    "yearsExperience": "39",
    "certifications": [
      "RGE",
      "Qualibat",
      "Qualipac"
    ],
    "serviceArea": null,
    "contact": {
      "phone": [
        "05 53 46 60 56"
      ],
      "email": [
        "contact@ets-leveque.fr"
      ],
      "address": "3061 ROUTE NATIONALE RN21 LES FARGES - NOTRE DAME DE SANILHAC - 24660 SANILHAC",
      "siret": null,
      "socialLinks": [
        {
          "platform": "facebook",
          "url": "https://www.facebook.com/levequechauffage24"
        },
        {
          "platform": "instagram",
          "url": "https://www.instagram.com/etsleveque24/"
        }
      ]
    },
    "keyFigures": [
      {
        "label": "ANNÉES D'EXPÉRIENCE",
        "value": 39,
        "source": "digit-reel"
      },
      {
        "label": "COMMUNES VISITÉES",
        "value": 641,
        "source": "digit-reel"
      },
      {
        "label": "RAMONAGE - ENTRETIENS RÉALISES EN 2025",
        "value": 4595,
        "source": "digit-reel"
      },
      {
        "label": "SALLE DE BAIN RÉALISÉES",
        "value": 210,
        "source": "digit-reel"
      },
      {
        "label": "MÊTRES DE CUIVRE DÉROULÉS EN 2025",
        "value": 3990,
        "source": "digit-reel"
      }
    ]
  },
  "sections": [
    {
      "id": "hero",
      "sourcePage": "https://ets-leveque.fr",
      "domSelector": "HEADER.mainHeader",
      "screenshot": null,
      "headline": null,
      "body": [],
      "items": [],
      "images": [
        "https://ets-leveque.fr/wp-content/uploads/2024/09/logo-ets-leveque-v3.png"
      ],
      "rawTextBlocks": []
    },
    {
      "id": "other",
      "sourcePage": "https://ets-leveque.fr",
      "domSelector": "SECTION.bt_bb_section",
      "screenshot": null,
      "headline": "Votre Chauffagiste à Notre Dame de Sanilhac",
      "body": [
        "NOUS INTERVENONS SUR PERIGUEUX ET SES ALENTOURS"
      ],
      "items": [],
      "images": [],
      "rawTextBlocks": [
        "NOUS INTERVENONS SUR PERIGUEUX ET SES ALENTOURS"
      ]
    },
    {
      "id": "other",
      "sourcePage": "https://ets-leveque.fr",
      "domSelector": "SECTION.bt_bb_section",
      "screenshot": null,
      "headline": "Votre Chauffagiste à Notre Dame de Sanilhac",
      "body": [
        "NOUS INTERVENONS SUR PERIGUEUX ET SES ALENTOURS"
      ],
      "items": [],
      "images": [],
      "rawTextBlocks": [
        "NOUS INTERVENONS SUR PERIGUEUX ET SES ALENTOURS"
      ]
    },
    {
      "id": "other",
      "sourcePage": "https://ets-leveque.fr",
      "domSelector": "SECTION.bt_bb_section",
      "screenshot": null,
      "headline": "ÉNERGIES RENOUVELABLES",
      "body": [
        "PAC, Chaudière biomasse, Poêle à granulés, Panneaux photovoltaïques Installation – Dépannage – Entretien",
        "Nettoyage & Neutralisation cuve fioul Installation de chaudières Dépannage – Entretien",
        "Création & Réfection de salle de bain Adoucisseur d’eau Installation – Dépannage – Entretien",
        "Mises aux normes électriques Bornes de recharge électrique Installation – Dépannage – Entretien",
        "Bois – Fioul – Gaz Contrat d’entretien Débistrage de conduit",
        "Chauffage Sanitaire – Plomberie Électricité générale"
      ],
      "items": [],
      "images": [],
      "rawTextBlocks": [
        "PAC, Chaudière biomasse, Poêle à granulés, Panneaux photovoltaïques Installation – Dépannage – Entretien",
        "Nettoyage & Neutralisation cuve fioul Installation de chaudières Dépannage – Entretien",
        "Création & Réfection de salle de bain Adoucisseur d’eau Installation – Dépannage – Entretien",
        "Mises aux normes électriques Bornes de recharge électrique Installation – Dépannage – Entretien",
        "Bois – Fioul – Gaz Contrat d’entretien Débistrage de conduit",
        "Chauffage Sanitaire – Plomberie Électricité générale"
      ]
    },
    {
      "id": "other",
      "sourcePage": "https://ets-leveque.fr",
      "domSelector": "SECTION.bt_bb_section",
      "screenshot": null,
      "headline": "NOS VALEURS La Qualité AVANT Tout",
      "body": [],
      "items": [],
      "images": [
        "https://ets-leveque.fr/wp-content/uploads/2024/11/RGE-LOGOS-2-e1732697760471.png"
      ],
      "rawTextBlocks": []
    },
    {
      "id": "contact",
      "sourcePage": "https://ets-leveque.fr",
      "domSelector": "SECTION.bt_bb_section",
      "screenshot": null,
      "headline": "Demandez votre devis gratuit",
      "body": [],
      "items": [],
      "images": [],
      "rawTextBlocks": []
    },
    {
      "id": "other",
      "sourcePage": "https://ets-leveque.fr",
      "domSelector": "SECTION.bt_bb_section",
      "screenshot": null,
      "headline": "Pompe à chaleur AIR-AIR",
      "body": [],
      "items": [],
      "images": [],
      "rawTextBlocks": []
    },
    {
      "id": "a-propos",
      "sourcePage": "https://ets-leveque.fr",
      "domSelector": "SECTION.bt_bb_section",
      "screenshot": null,
      "headline": "Notre entreprise en chiffres",
      "body": [],
      "items": [],
      "images": [],
      "rawTextBlocks": []
    },
    {
      "id": "other",
      "sourcePage": "https://ets-leveque.fr",
      "domSelector": "SECTION.bt_bb_section",
      "screenshot": null,
      "headline": "Nos Partenaires",
      "body": [],
      "items": [],
      "images": [
        "https://ets-leveque.fr/wp-content/uploads/2022/10/viessmann-1.png",
        "https://ets-leveque.fr/wp-content/uploads/2022/10/mitszu.png",
        "https://ets-leveque.fr/wp-content/uploads/2022/10/legrand-1.png",
        "https://ets-leveque.fr/wp-content/uploads/2022/10/hargassner.png",
        "https://ets-leveque.fr/wp-content/uploads/2022/10/hoben.png",
        "https://ets-leveque.fr/wp-content/uploads/2024/11/BWT.png"
      ],
      "rawTextBlocks": []
    },
    {
      "id": "other",
      "sourcePage": "https://ets-leveque.fr",
      "domSelector": "SECTION.bt_bb_section",
      "screenshot": null,
      "headline": "Expérience clients",
      "body": [
        "4.3"
      ],
      "items": [],
      "images": [
        "https://ets-leveque.fr/wp-content/uploads/2026/06/ChIJ3d8GLzN6_0cR3m8L0ENcy9c.jpg",